,category,text
0,жалоба на продукты услуги bankname,акц комфортел num регион свердловская область населенный пункт с потруши вопрос клиента приходят ошибочно смс не понятного содержания о name что у меня арестован счет арест средств
1,жалоба на продукты услуги bankname,акц комфортел num регион карачаево черкесская республика населенный пункт карачаевск вопрос клиента по какой причине сб отказывает в получении потребительский кредита если кредитная история не нарушена
2,смс рассылка,клиент утверждает что является bankname с февраля num г клиенту на номер num с номера num поступает смс о name что нужно погасить долг по кредиту просьба отключить смс с данного номера телефона
3,благодарность,хочу выразить большую благодарность сотруднице bankname эляй name за решение моего проблемного вопроса который не разрешался в течении года до этого ни кто name сотрудников не обладал такой целеустремлённостей в решении моего вопроса
4,причина кто наложил арест,акц комфортел num всп bankname в котором ведется счет num карты счета вклада num вопрос клиента причина кто наложил арест ответ просит получить телефонным звонком
5,причина кто наложил арест,акц комфортел num всп bankname в котором ведется счет name обл г name ул name 14 карты счета вклада num дата подачи документов на снятие наложение ареста date вопрос клиента причина кто наложил арест
6,вопрос,обращения num от date как долго продлится рассмотрение данного вопроса у меня 1 группа инвалидности и данная сумма просто необходима для приобретения инвалидной коляски постоянно ожидать то 20 то 30 теперь 60 дней каковы окончательные сроки
7,отключение рекламных рассылок,акц комфортел num территориальный bankname московский bankname телефона отправителя смс уведомления num телефона на который поступило смс num вопрос клиента необходимо отключить смс рассылку
8,вопрос,добрый день на данный момент гражданин россии находится в молдове и задает вопрос в bankname какого местного bankname он может снять средства с наименьшими потерями заранее спасибо
9,отключение рекламных рассылок,акц комфортел num номер на который поступают звонки num номер с которого поступают звонки num вопрос клиента поступвют звонки постоянно просит прекратить
10,претензия,верните мне мой мобильный bankname у меня нет вирусов на телефоне как снимать с меня абонентскую плату вы не спрашиваете про вирусы а когда я переводы делаю так вы меня блокируете
11,статус исполнительного документа,акц комфортел num всп bankname в котором ведется счет г москва name 25 карты счета вклада num дата подачи документов на снятие наложение ареста date вопрос клиента статус исполнительного документа
12,смс рассылка,акц ик num клиенту поступают сообщения о задолжностях по кредитной карте оформленных на другого человека просьба клиента не направлять ему подобные сообщения исключить его номер name адресной рассылки
13,вопрос,добрый день вопрос хочу взять кредит в вашем bankname но по 2ндфл у меня num на какую сумму я могу расчитывать по форме bankname на работе мне справку не дают спасибо
14,получение информации,могу ли я в чехии рассчитаться моей зарплатной картой tr num по какому курсу будет производится эта оплата смогу ли снять наличные если tr в европе не принимают то можно поменять карту на tr
15,жалоба на продукты услуги bankname,акц комфортел num регион name область населенный пункт зеленоград вопрос клиента приходит сообщения на name name о предоставлении кредита с номера прошу настоятельно отключить данное сообщение
16,получение информации,в num году взяли ипотеку кредитный договор num под 12 годовых платим исправно сейчас ставка по ипотеке составляет 10 9 можем ли мы понизить до этого процента свой кредит
17,жалоба на продукты услуги bankname,акц комфортел num регион челябинская область населенный пункт челябинск вопрос клиента выписку по кредиту не выдает дочке заемщику в офисе num челябинское отделение пао bankname так как она не является созаемщиком
18,мобильный bankname,столкнулся с такой проблемой что устанавливая мобильный bankname после проверки на вирусы появляется ошибка связанная с name но телефон в состояний почти только с name и никакого name на нем не было
19,обслуживание,акц ик num отделение города новочебоксарска name 20 номер отделения num отказывает в выдаче наличных денежных средств клиенту с его bankname книжек оператор name клиент просит ответ получить по телефону
20,жалоба связана с услугой bankname онлайн,акц комфортел num регион краснодарский край населенный пункт красногвардейское вопрос клиента непоступление денежных средств при переводе через bankname онлайн
21,жалоба,добрый день исходя name вашего ответа можно сделать вывод что сотруднику лучше не выдать кредит чем выдать его без страховки верно и получить на кредит на условиях специального предложения я не могу то есть bankname не нужна прибыль
22,жалоба на продукты услуги bankname,акц комфортел num регион город санкт петербург населенный пункт санкт петербург вопрос клиента клиенту bankname по словам клиента заявление по карте никак не могут рассмотреть от 16 октября num года номер всп num
23,bankname,с утра пытаюсь на карту деньги пополнить через bankname в махачкале улица name 37 но ни один не работает приходится ждать пока откроют bankname до 10часов очень не удобно
24,жалоба,акц аудиотеле num со слов клиента клиент недоволен количеством терминалов и bankname расположенных в г ликино дулево московской области со слов клиента особенно возникает проблема со вносом наличных средств на карту
25,возврат денежных средств,num произошло списание платы за овердрафт в размере 6 56р с моей карты виза num данное списание считаю не правомерным прощу разобраться и вернуть денежные средства спасибо
26,консультация,здравствуйте на данный момент нахожусь в стоп листе bankname возможно ли как то выйти name него или что то еще чтобы возможно было пользоваться услугами данного bankname г хабаровск
27,статус исполнительного документа,акц комфортел num всп bankname в котором ведется счет уфа реворлюционная 57 карты счета вклада num дата подачи документов на снятие наложение ареста date вопрос клиента статус исполнительного документа
28,жалоба на недозвон в урпзфл,акц комфортел num номер телефона на который обращался клиент num номер телефона с которого звонил клиент num вопрос клиента подовал документы на реструктуризацию кредита и на протяжение 2 5 недель нету ответа
29,отключение рекламных рассылок,акц комфортел num номер на который поступают звонки num номер с которого поступают звонки num вопрос клиента клиент желает исключить свой номер от данного обзвона
30,кредит,как рассчитать кредит для пенсионера в омске семья name двух пенсионеров получающих пенсию через ваш bankname в сумме num и num под какой процент на срок 24 месяца и на сумму num возраст женщина 59 лет и мужчина 60 лет нужна консультация и расчет
31,статус исполнительного документа,акц комфортел num всп bankname в котором ведется счет белгород карты счета вклада num дата подачи документов на снятие наложение ареста date вопрос клиента статус исполнительного документа
32,жалоба на продукты услуги bankname,акц комфортел num регион республика саха якутия населенный пункт якутия вопрос клиента звончт сотрудники bankname по неизвестному мне человеку name name просьба прекратить эти звонки
33,жалоба связана с услугой bankname онлайн,акц комфортел num регион тюменская область населенный пункт г лянкор вопрос клиента через сбол ввела свои реквизиты но система сбол перенаправила на другие реквизитвы
34,многозвонящий клиент,акц комфортел num многозвонящий клиент екатеринбург клиент интересуется почему в крыму bankname не может открыть дополнительный офис bankname просит повлиять на данный вопрос
35,общие обращения,акц комфортел num адрес эл почты с которого поступило сообщение email адрес эл почты на который поступило сообщение email вопрос клиента отключить всю рекламную рассылку от bankname
36,жалоба на продукты услуги bankname,акц комфортел num регион забайкальский край населенный пункт с калга вопрос клиента клиент жалуется на то что по социальной карте не происходит начисление процентов а именно 3 5
37,не работает bankname,акц ик num месторасположения ус нижегородская обл пос пруды краснобаковский р н клиент жалуется после новогодних name bankname вышел name name и до сих пор не установлен новый клиенты не могут снять денежные средства
38,отключение рекламных рассылок,акц комфортел num номер на который поступают звонки num номер с которого поступают звонки num вопрос клиента клиент не желает получать звонки от bankname с предложением оформить продукты и услуги bankname
39,жалоба на продукты услуги bankname,акц комфортел num регион name край населенный пункт красноярск вопрос клиента в г красноярск ул мусорского 18 не корректно раболтает bankname не переводит переодически денежные средства не ищет name
40,отключение рекламных рассылок,акц комфортел num территориальный bankname среднерусский bankname телефона отправителя смс уведомления num телефона на который поступило смс num вопрос клиента отключить рекламную рассылку
41,жалоба на продукты услуги bankname,акц комфортел num регион город москва населенный пункт город москва вопрос клиента на станции метро name name перестал работать bankname очень нужен на name станции просим отремонтировать в кратчайшие сроки
42,причина кто наложил арест,акц комфортел num всп bankname в котором ведется счет г санкт петербург пр просвящения карты счета вклада num num дата подачи документов на снятие наложение ареста date вопрос клиента причина кто наложил арест
43,жалоба на продукты услуги bankname,акц комфортел num регион оренбургская область населенный пункт п светлый раойн сакмарский вопрос клиента не работает bankname касса и bankname интересуется когда будет восстановлен bankname
44,смс рассылка,акц аудиотеле num клиент обращается name г москва клиенту на номер num поступают смс с номера num рекламного характера просьба отключить смс информирование по продуктам и услугам сб рекламного характера
45,статус исполнительного документа,акц комфортел num всп bankname в котором ведется счет ижевск карты счета вклада дата подачи документов на снятие наложение ареста date вопрос клиента статус исполнительного документа
46,жалоба связана с услугой мобильный bankname,акц комфортел num регион омская область населенный пункт г омск вопрос клиента я не могу отправить перевод при помощи услуги мб на карту стороннего bankname num
47,претензия,29 января num года на официальном сайте bankname была оформлена заявка num на выпуск дебетовой карты с индивидуальным дизайном сегодня num прошло уже 6 рабочих дней а ответ о стадии рассмотрения заявки я так и не получила
48,ипотека,добрый день одобрена ипотека в bankname одобрили num если в срок 2 мес мы не найдем подходящую квартиру через какое время мы снова можем подать заявку и возможно ли это и есть ли гарантия того что и 2 раз будет одобрение
49,жалоба,не могу на карты внести деньги уже второй день не работают bankname на акушинского 29 рядом с яблочко почему такая проблема для махачкалы настроить bankname нужно ждать до понедельника пока не будет работать bankname
50,возврат денежных средств,date года я name name оплатил госпошлину в размере num руб по ошибочным реквизитам у организации поменялся бик date года прошу вернуть раннее уплаченную сумму по ошибочным реквизитам в размере num руб
51,жалоба связана с услугой bankname онлайн,акц комфортел num регион город москва населенный пункт москва вопрос клиента не правильные реквизиты при оплате сотовой связи по номеру num date через программу сбол в размере 70 рублей
52,смс рассылка,акц аудиотеле num алтайский край п name date после time со слов клиента зызлаевой name name с номера num на номер num поступают смс сообщения на имя name name переводите свои bankname в bankname
53,претензия,с моей карты num date и date было несанкционированное списание по num рублей в общей сумме tr прошу разобраться в name ситуации и вернуть денежные средства мне на карту
54,вопрос,здравствуйте вопрос можно получить карту в нижнем новгороде удобном для меня отделении bankname если карта изготовлена и находиться в отделение города кулебаки нижегородская обл карта социальная
55,кредитная карта,акц ик num у клиента в конце прошлого года истекла кредитная карта карта оформлялась на перевыпуск в феврале перевыпущенная карта пришла без пин конверта дважды данные события произошли в оф num
56,претензия,прошу вас убрать name своей базы мой номер num принадлежащий мне на основании заключенного договора от date с компанией ооо т2 мобайл так как номер более не принадлежит бывшему владельцу
57,благодарность,здравствуйте хотелось бы поблагодарить за очень качественно обслуживание двух консультак к сожалению не узнал их имен в отделении которое располагается по адресу город заринск улица металлургов num
58,не работает bankname,когда отремонтируют bankname по адрессу п правдинский шоссе степаньковское 17 срочно нужно сделать перевод сотрудники отделения bankname отказывают ссылаясь на то что такую операцию надо производить через bankname
59,многозвонящий клиент,акц комфортел num многозвонящий клиент омск желает чтобы немедленно подключили мобильный bankname ждать никого не собирается подключить самостоятельно отказывается
60,отключение рекламных рассылок,акц комфортел num номер на который поступают звонки num номер с которого поступают звонки num вопрос клиента просьба незвонить и не рассылать сообщения на номер num это другой хозяин
61,вопрос по материальной экономической выгоде,акц комфортел num name материальной экономической выгоды num номер всп направившего уведомление name краткое содержание письма уплата налога вопрос клиента в связи с чем поступило письмо
62,консультация,добрый день я являясь поручителем исполнила обязательства за заемщика для предъявления в суд мне нужна справка о name что я исполнила за заемщика обязвтельства по погашению долга который он не оплачивал как мне получить такой документ
63,жалоба,не могу получить карту просидел в очереди час с лишним очень медленно работают сотрудники грубо отвечают на вопросы прошу провести воспитательную беседу
64,жалоба на продукты услуги bankname,акц комфортел num регион город санкт петербург населенный пункт санкт петербург вопрос клиента name обороны дом 70 номер bankname num bankname забирает и не отдает карты неоднократное обращение
65,отключение рекламных рассылок,акц комфортел num территориальный bankname северо западный bankname телефона отправителя смс уведомления num телефона на который поступило смс num вопрос клиента исключить name рассылок данный номер по кредитам третьих лиц
66,жалоба на продукты услуги bankname,акц комфортел num регион город москва населенный пункт name пруды 12 кор 1 вопрос клиента режим работы с time не обслужили талон т1 специалистов нет в очереди 30 мин
