,category,text
1223,жалоба связана с услугой bankname онлайн,акц комфортел num регион республика татарстан населенный пункт набережные челны вопрос клиента перевод с в bankname онлайн должен осуществляться мгновенно денежные средства не поступили клиенту
1224,консультация,здраствуйте подскажите пожалуйста я забыл свою карту и мобильный на даче могули я снять с неё деньги в отделении bankname или перевести деньги на bankname num
1225,жалоба на продукты услуги bankname,акц комфортел num регион иркутская область населенный пункт иркутск вопрос клиента жалоба на смс рассылку по кредиты разобраться почему пришла смс что исключили а смс рассылка приходит разберитесь
1226,причина кто наложил арест,акц комфортел num всп bankname в котором ведется счет город новый воронеж парковый проезд 10 карты счета вклада num вопрос клиента причина кто наложил арест
1227,статус исполнительного документа,акц комфортел num всп bankname в котором ведется счет город мурманск карты счета вклада num дата подачи документов на снятие наложение ареста date вопрос клиента статус исполнительного документа
1228,вопрос,скажите как мне узнать точный пеоевод на мою карту от определённого человека за конкретный период смс стёрлись а в bankname онлайн вообще бред какой то мне не нужны все мои переводы и начисления нужны денежные переводы от определённого человека
1229,не работает bankname,аудиотеле акц num г краснодар ул тургеневна num отделение num по данному адресу не работает bankname на прием наличных уже вторую неделю уже неоднократно была составлена заявка но bankname так и не исправлен
1230,общие обращения,акц комфортел num на мой номер телефона num приходят смс сообщения с номера num раз в num дня с предложением получить кредит в пао bankname прошу чтобы данные смс сообщения мне больше не приходили
1231,претензии на доп офис,акц комфортел num субъект федерации name область населенный пункт ст цаказанская улица улица name дом 36а дата и время произошедшей ситуации обращения в всп date
1232,неработоспособность ус,акц аудиотеле num клиент настаивает на обращение tr город курган улица name дом 25 тц пушкинский на date 13 25 по мск не работает надпись ведутся тех работы так ситуация со слов клиент с этим bankname часто
1233,причина кто наложил арест,акц комфортел num всп bankname в котором ведется счет серпуховский карты счета вклада num num вопрос клиента причина кто наложил арест фамилию исполнителя контактные данные
1234,претензия,здравствуйте с моей зарплатной карты tr tr num были списаны деньги date date и date г по num рублей каждый раз я эти платежи не совершал прошу разобраться каким образом были списаны эти деньги без моего ведома и вернуть их
1235,консультация,добрый вечер я хочу заказать дебетовую карту моментум виза обратилась в отделение bankname г name мне сообщили что таких карт больше нет можно уточнить так ли это спасибо
1236,жалоба,добрый день уже не первый раз в отделении bankname на ул name 58 допофис num работает 1 оператор на весь зал так теперь будет всегда мало того что работать стали меньше по времени и выходных 2 дня так теперь еще и очереди спасибо
1237,жалоба,добрый день требую ответа на мое ранее поданное обращения num срок ответа установленный bankname истек о продлении срока ответа меня никто не уведомлял так же как и самого ответа не последовало буду вынуждена обратиться с жалобой в цб
1238,жалоба связана с услугой bankname онлайн,акц комфортел num регион город москва населенный пункт москва вопрос клиента обновление программы личного кабинета сбол мобильная версия полностью не удовлетворяет клиента 2 name по 5 бальной шкале
1239,жалоба,в г махачкале по ул венгерских у bankname ужасно работает клавиатура передо мной девушка кое как набрала пинкод даже мне это было трудно причём такая ситуация с клавиатурой тянется уже давно и никто ничего не предпринимает разберитесь с этим пожалуйста
1240,перевыпуск карты,я обратился в отделение bankname с просьбой перевыпустить карту в связи с тем что карта была утеряна однако в перевыпуске мне отказали прошу вас пояснить причину отказа
1241,благодарность,благодарю сотрудниц оформивших 5 апреля bankname сертификат в отделении ул алабяна д 13 за благожелательность профессионализм и вежливость с уважением д а name
1242,жалоба,добрый день вчера переводил деньги со своей карты num на карту жены num две тысячи рублей но жена на карте нашла чуть больше num руб прошу объяснить причину с уважением name name
1243,неработоспособность ус,акц аудиотеле num дату и время попытки проведения операции date 17 20 характер поломки не включен не принимает карту не доступна какая либо опция не включен
1244,смс рассылка,акц аудиотеле акц num мне в алтайский край г бийск на номер num уже неделю приходят смс с номера num с напоминанием о внесении средств на кредит name name я таких не знаю прошу удалить мой номер name name смс рассылки
1245,жалоба связана с услугой bankname онлайн,акц комфортел num регион name область населенный пункт балашихинский р н вопрос клиента сбросился идентификатор и пароль при обновлении сбол не в первый раз
1246,претензии на доп офис,акц комфортел num субъект федерации населенный пункт всп дата и время произошедшей ситуации обращения в всп date подробное описание произошедшей ситуации сотрудник bankname повышает голос хамское общение на клиента
1247,консультация,планируем взять ипотеку примерно 1млн руб внесем первоначальный взнос 50 процентов вскоре получим материнский капитал хочется узнать как будет погашен кредит материнским капиталом т е основная часть или проценты прошу разъяснить
1248,многозвонящий клиент,акц комфортел num многозвонящий клиент екатеринбург привязка мобильного телефона к bankname онлайн прелагает ввести альтернативу в пользовании bankname онлайн требует компенсацию в сумме num руб
1249,жалоба,мною было составлено обращение num от tr день вы сдвигаете сроки рассмотрения данного обращения и вынесения решения по моему вопросу когда прекратиться это безобразие когда будет поставлена точка
1250,причина кто наложил арест,акц комфортел num всп bankname в котором ведется счет город новосибирск доп офис num вокзальная магистраль 16 карты счета вклада num вопрос клиента причина кто наложил арест
1251,многозвонящий клиент,акц комфортел num многозвонящий клиент екатеринбург клиент требовал перевести его на оператора который по обращениям а потом потребовал перевести его на старшего специалиста обращение он отказался фиксировать
1252,возврат денежных средств,17 04 tr был произведет платеж с карты num через онлайн bankname на сумму num рублей получатель авито подавалось объявление оплата произошла дважды прошу вернуть денежные средства в сумме num рублей по указанному номеру карты
1253,розыск всп,акц омск акц num город петрозаводск у клиента закончился срок действия кредитной карты num карту оформлял в офисе num информации по данному офису не предоставлено по какому адресу нужно обратиться за получением карты
1254,причина кто наложил арест,акц комфортел num всп bankname в котором ведется счет ленинский район ул им name с ф 29а карты счета вклада num вопрос клиента причина кто наложил арест почему минус 29 тыс на карте
1255,жалоба на продукты услуги bankname,акц комфортел num регион город санкт петербург населенный пункт поселок name вопрос клиента перегораживание проезжей части машиной инкассаторов клиент требует чтобы дорога была свободная
1256,мобильный bankname,на мой номер телефона num приходят смс уведомления о входе в bankname онлайн и по переводам денежных средств третьим лицам прошу отключить все посторонние карты от моего номера телефона
1257,отключение рекламных рассылок,акц комфортел num номер на который поступают звонки num номер с которого поступают звонки num вопрос клиента поступают звонки с предложениями по кредиту
1258,жалоба,получила карту обычную заявление там где указаны личные данные кодовое слово никто не даёт говорят мы их не выдаём краснодарский край город туапсе ул name марска и сотрудники хамы и повышают голос особенно сотрудница name name окно 5
1259,консультация,у меня есть ваша карта на которую перечисляют пенсию для расплаты на сайтах хотел завести ещё одну скажите могу её получить и ещё одну бесплатно в обслуживании
1260,жалоба связана с услугой bankname онлайн,акц комфортел num регион новособирская область населенный пункт новосибирск вопрос клиента при входе в личный кабинет приходит половина смс сообщения вторая с запозданием и клиент не может войти
1261,получение информации,добрый день у меня есть депозитный вклад в bankname num рублей хотел бы перевести данную сумму в tr и оставить на депозите какие условия и какой курс может предложить bankname вклад открыт в спб
1262,жалоба,в bankname по пр name num примерно в 13 name 8 февраля моей матери сотрудник окошка 5 назвал ее сумму в num рублей мелочью и негодовал почему она не пользуется кредиткой зачем женщине в возрасте такое выслушивать
1263,причина кто наложил арест,акц комфортел num всп bankname в котором ведется счет num карты счета вклада num дата подачи документов на снятие наложение ареста date вопрос клиента причина кто наложил арест и за что
1264,вопрос,у меня карта маэстро пенсионная в поездках по стране собираюсь посетить кемеровскую область и краснодарский край смогу ли я в bankname bankname получать наличные без комиссии смогу ли оплачивать покупки и услуги без комиссии
1265,кредитная карта,нет подходящей тематики 28 ноября tr я обращалась в bankname с заявлением о разблокировки кредитной карты num хочу обратиться ещё раз с этой просьбой в связи с тяжелым финансовым положением разблокировать кредитную карту
1266,консультация,прошу подтвердить участие bankname в программе государственной компенсации ипотечных кредитов требований предъявляемых к участникам а также предварительно возможность участия в программе договора num от date
1267,жалоба на продукты услуги bankname,акц комфортел num регион name область населенный пункт рязань ул name д 8 вопрос клиента клиент просит поставить bankname т к расположение ближайшего bankname не удобно для name name 8 или 4
1268,причина кто наложил арест,акц комфортел num всп bankname в котором ведется счет амурсая область город белогорск карты счета вклада num вопрос клиента причина кто наложил арест куда обращяться
1269,причина кто наложил арест,акц комфортел num всп bankname в котором ведется счет город name name name num карты счета вклада num дата подачи документов на снятие наложение ареста date вопрос клиента причина кто наложил арест
1270,смс рассылка,акц ик num фио клиента name name name контактный номер телефона num город калининград суть обращения клиент просит отписать его от новостной рассылки bankname на его электронный ящик email
1271,жалоба связана с услугой мобильный bankname,акц комфортел num регион приморский край населенный пункт г лесозаводск вопрос клиента клиент жалуется на то чток нему приходят смс сообщения по услуге мобильного bankname он не является клиентом bankname
1272,жалоба на недозвон в урпзфл,акц комфортел num номер телефона на который обращался клиент num номер телефона с которого звонил клиент num вопрос клиента кл не может дозваниться до урпзфл
1273,жалоба,произошло списание со вклада добрый год номер num сумма num рублей это был наложен арест при этом есть bankname счёт с которого могло быть списание в результате данного списание я лишился процентов по вкладу прошу проценты по вкладу вернуть
1274,жалоба на продукты услуги bankname,акц комфортел num регион республика татарстан населенный пункт набережные чалны вопрос клиента заблокирован сбол при обращении причиной указали перевод которого не было и такие суммы никогда не приходили
1275,жалоба на продукты услуги bankname,акц комфортел num регион name область населенный пункт name вопрос клиента приобрела новый номер телефона стали приходить смс по третьему лицу на name name прошу отключить этот номер num теперь принадлежит мне
1276,жалоба,спасибо за отписку в ответ на мою жалобу num я её обязательно приложу при подаче заявления в управление президента российской федерации по работе с обращениями name и организаций укажите пожалуйста автора этой отписки
1277,многозвонящий клиент,акц комфортел num многозвонящий клиент омск жалоба на сотрудника num не вникла в проблему не грамотный оператор клиент требует уволить этого сотрудника штраф с сотрудника перевести на счет клиента
1278,неработоспособность ус,акц комфортел num регион установки ус name область город населенный пункт город смоленск адрес улица name дом 50 место установки num номер ус num характер поломки не включен вопрос клиента не работает bankname
1279,жалоба на продукты услуги bankname,акц комфортел num регион иркутская область населенный пункт г иркутск вопрос клиента клиент крайне недоволен тем что bankname не уведомляет о name что наложен арест на счета
1280,причина кто наложил арест,акц комфортел num всп bankname в котором ведется счет г тольяти ул name 14 карты счета вклада num дата подачи документов на снятие наложение ареста date вопрос клиента причина кто наложил арест
1281,отключение рекламных рассылок,акц комфортел num номер на который поступают звонки num номер с которого поступают звонки num вопрос клиента поступают звонки о предложении кредитных карт
1282,неработоспособность ус,акц аудиотеле num обращается клиент по поводу неработоспособности bankname bankname num и num расположенных по адрес г москва ул габричевского д num на протяжении двух недель не работают на прием купюр
1283,отключение рекламных рассылок,акц комфортел num номер на который поступают звонки num номер с которого поступают звонки вопрос клиента клиент желает чтобы ни когда не звонили на этот
1284,не работает bankname,акц ик num по адресу г подольск проспект name дом 9 в num не работает картоприемник у bankname катроприемник периодически не работает клиент просит починить bankname исправить работу картоприемника
1285,консультация,имею ипотечный кредит но в bankname онлайн в разделе кредиты он не высвечивается как я могу исправить данную ситуацию и в дальнейшем отслеживать данный кредит прилагаю скриншот странички
1286,перевыпуск карты,добрый день в любом ли отделение можно перевыпустить карту последние четыре цифры num или только там где получали карта оформлена для получения пенсии спасибо с уважением name
1287,жалоба на продукты услуги bankname,акц комфортел num регион ставропольский край населенный пункт кисловодск вопрос клиента не согласен со сроком зачисления средств на его счёт с name кошелька
1288,консультация,здравствуйте я являюсь индивидуальным предпринимателем необходим счет для поступления денежных средств от name лица 1 раз в месяц у меня вопрос есть ли возможность оформить карточный счет физ лица для ведения предпринимательской деятельности
1289,причина кто наложил арест,акц комфортел num всп bankname в котором ведется счет санкт петербург name проспект 59 лит а карты счета вклада num вопрос клиента причина кто наложил арест
