,category,text
610,вопрос,здравствуйте на телефон пришло смс с номера num списание средст tr tr tr tr и пароль что это означает просто реклама или у кого то есть доступ к моей карте на карте средств для списания нет только на кредитной
611,розыск всп,акц омск акц num у клиента оформлена кредитная карта num в городе воронеж num но данного офиса нет в городе по какому адресу может обратиться клиент за получением новой карты перевыпуск карты будет производится в мае
612,возврат денежных средств,tr осуществляла перевод со своей карты num на карту другого bankname по номеру карты num в размере num смс о списании пришло а в приложении bankname онлайн деньги не списаны
613,консультация,если переводить деньги с дебетовой карты bankname на карту bankname через форму на их сайте то будет ли удержана комиссия за перевод с карты на карту вашим bankname
614,вопрос по материальной экономической выгоде,акц комфортел num name материальной экономической выгоды num номер всп направившего уведомление num краткое содержание письма налог на доход вопрос клиента недостаточно информации
615,отключение рекламных рассылок,акц комфортел num территориальный bankname волго вятский bankname телефона отправителя смс уведомления num телефона на который поступило смс num вопрос клиента жалоба на рекламу
616,жалоба связана с услугой bankname онлайн,акц комфортел num регион город москва населенный пункт москва вопрос клиента при запросе полной выписки в сбол операция отражается с задержкой в 3 рабочих дня
617,жалоба на продукты услуги bankname,акц комфортел num регион город москва населенный пункт москва вопрос клиента районе выхино жулебино мало bankname те которые имеются работают только до 5 клиент просит расширить список bankname
618,жалоба на продукты услуги bankname,акц комфортел num регион челябинская область населенный пункт челябинск вопрос клиента приобрела name карту теле2 с номером num теперь поступает инфо по третьему лицу прошу обновить база не беспокоить
619,жалоба на продукты услуги bankname,акц комфортел num регион город москва населенный пункт г москва вопрос клиента клиенета не устраивает что на станции метро академическая нет работающих bankname и bankname для внесения денежных средств
620,кредит,я name name хочу взять в вашем bankname кредит погашение гарантирую в срок нуждаюсь в наличии денег для улучшения и благоустройства своей квартиры сумма нужна tr р оплата в 20х числах онлайн
621,жалоба,добрый день с моей карты была снята сумма в размере 60 руб за оплату мобильного bankname услугу я себе не подключала прошу вернуть деньги и отключить услугу спасибо name name
622,смс рассылка,акц аудиотеле num клиенту сномера num поступают смс сообщения с предодобренными предложениями по кредиту клиент не желает получения подобных сообщений рассылка поступает на номер num карта клиента оформлена в волгограде
623,неработоспособность ус,акц ик num со слов клиента г дербент республика дагестан не работают bankname на приём наличных объездил 4 точки даже в центральном безобразие наведите порядок в работе приемпа наличных в bankname
624,претензии на доп офис,акц комфортел num субъект федерации name область дата и время произошедшей ситуации обращения в всп date подробное описание произошедшей ситуации коллективная жалоба на работу bankname в г щелково в центральном bankname
625,жалоба на продукты услуги bankname,акц комфортел num регион новосибирская область населенный пункт новосибирск вопрос клиента клиента не устраивают регламентные сроки зачисления ден ср в в пользу интернет провайдера ттк западная сибирь
626,жалоба связана с услугой bankname онлайн,акц комфортел num регион город москва населенный пункт москва вопрос клиента на каком основании bankname продлевает сроки рассмотрения заявления изначально заявлялись сроки в 10 дней от 2 марта num г
627,смс рассылка,мне на телефон поступают смс сообщения с номера num о name что поступает перевод денежных средств от третьих лиц эти переводы меня не касаются т к этих людей я не знаю и никаких поступлений на карту у меня не происходит прошу отключить данную смс рассылку
628,отключение рекламных рассылок,акц комфортел num номер на который поступают звонки num номер с которого поступают звонки num вопрос клиента клиенту звонять и просят позвать к телефону другое лицо которого клиент не знает
629,мобильный bankname,две карты привязаны к одному номеру как сделать чтобы все переводы и автоплатежи были только на одной карте а не списывались то с одной то с другой карты
630,перевыпуск карты,пришла смс с инфо о перевыпуске карты но предлагаемое отделение bankname где можно будет получить новую карту неудобно по графику работы можно ли сменить отделение и как последние цифры карты num
631,жалоба связана с услугой мобильный bankname,акц комфортел num регион город москва населенный пункт г москва вопрос клиента клиент изъявляет желание чтобы ему больше не поступало любое информирование смс и любые телефонные звонки со стороны bankname
632,статус исполнительного документа,акц комфортел num всп bankname в котором ведется счет num карты счета вклада num дата подачи документов на снятие наложение ареста date вопрос клиента статус исполнительного документа когда будет снят арест
633,консультация,скажите пожалуйста взымается ли комиссия при оплате картой покупок а также снятии наличных в bankname bankname в другом регионе если да то в каком размере заранее благодарен
634,возврат денежных средств,date я со своей карты num совершил покупку в интернет магазине tr tr на сумму num 68 date эта сумма была списана второй раз прошу вернуть указанную сумму на мою карту
635,перевыпуск карты,здравствуйте прошу вас разобраться по какой причине мне так долго перевыпускают карту bankname num если заявление было подан на перевыпуск карты 1февраля tr
636,перевыпуск карты,здравствуйте я потерял карту заблокировал ее и теперь хочу перевыпустить забрать хотелось бы в отделении bankname по адресу ленинский проспект д 71 последние цифры карты num спасибо
637,получение информации,здравствуйте скажите пожалуйста можно ли в снять деньги в рублях через bankname или терминал с эстонской карты bankname tr на которой имеется сумма в евро если можно то в любом ли отделении bankname на территории рф спасибо
638,получение информации,просьба уточнить куда обратиться по возврату вклада сделанного до num года в bankname ссср документы ао вложенном файле контактный тел num почта email
639,отключение рекламных рассылок,акц комфортел num номер на который поступают звонки num номер с которого поступают звонки num вопрос клиента приходят смс и звонки name name клиент не имеет никокого отношения к этим людям
640,жалоба,добрый день уже неоднакратно обращался в вашу организацию с требованием прекратить высылать мне на эл почту письма которые мне непредназначены требую в очередной раз прекратить рассылку на мой эл адрес email письма приходят от bankname россии email
641,жалоба на продукты услуги bankname,акц комфортел num регион краснодарский край населенный пункт краснодар вопрос клиента с 22 января bankname не работает name имени name никаких функций не выполняет name экран как перезагрузка система
642,bankname,добрый день я за границой и хочу открыть bankname онлайн возможно ли это если я предоставлю свои паспортные данные и номер счёта вам онлайн дебетной карты у меня нет
643,жалоба связана с услугой bankname онлайн,акц комфортел num регион омская область населенный пункт г омск вопрос клиента невозможен вход в личный кабинет сбол специалисты не могут помочь решить данную проблему
644,вопрос,доброе время суток кредитный договор num от 27 октября num г процентная ставка 12 можно у вас попросить снижение по кредиту так как снижена ставка цб и сейчас num спасибо за понимание
645,статус исполнительного документа,акц комфортел num всп bankname в котором ведется счет name name 10или8 карты счета вклада num дата подачи документов на снятие наложение ареста date вопрос клиента статус исполнительного документа
646,благодарность,привет команда bankname спасибо за поздравление с 8 мартом желаю всего прекрасного в ваших семьях и делах и конечно крепкого здоровья с уважением тоглоева name цырен дашиевна
647,общие обращения,выбрана не корректная тематика т к по данному вопросу отлож нет акц комфортел num номер на который поступают звонки num номер с которого поступают звонки num вопрос клиента просит прекратить звонки от bankname
648,перевыпуск карты,моя зарплатная карта мастер карт стандарт подходит к концу при автоматическом перевыпуске я получу такую же и ли мне выдадут уже автоматически карту мир я категорически против карты мир
649,жалоба,г домодедово ул советская дом 1 отделение закрывается tr закрылись в 16 20 на вопрос что хотим снять наличные валюту со своего лицевого счета сотрудник сказал что валюту сдали в tr отношение прошу принять меры
650,неработоспособность ус,акц аудиотеле num жалоба на два регулярно неработающие ус на взнос наличных расположенные по адресу г санк петербург ул смолячкова дом 19 звонок клиента сорвался
651,вопрос,в отделении bankname в г новороссийск был взят ипотечный кредит в num г теперь предлагается застраховать жизнь 17 т р либо повысить процентную ставку на 1 это законно или местная инициатива
652,розыск всп,tr номер всп адрес всп регион город улица номер дома г железнодорожный микрорайон павлено категория обслуживания клиента фл юл фл причина обращения в всп розыск дата и время обращения клиента в всп если обращался date
653,претензии на доп офис,акц комфортел num субъект федерации кировская область населенный пункт пгт рудничный улица улица орджониидзе дом 26 дата и время произошедшей ситуации обращения в всп date
654,консультация,доброго времени суток прошу вас подтвердить факт взаимодействия со специалистом контактного центра клиента name name name по телефону num осуществленного 12 апреля num года в период времени с time до time
655,претензии на доп офис,дата и время произошедшей ситуации обращения в всп date подробное описание произошедшей ситуации неоднократно требуют оформить отношения с риелтором для того чтобы не затягивать рассмотрение документов по сделке
656,жалоба на продукты услуги bankname,акц комфортел num регион name область населенный пункт г долгопрудный вопрос клиента в time сотрудник name при обращении в кц была предоставлена некорректная информация было составлено обращение num от date
657,смс рассылка,акц аудиотеле num со слов клиента поступают смс с номера num на номер num на имя name name владелец телефона данного человека не знает просит изъять данные рассылки с его номера телефона
658,вопрос,добрый день есть вопрос я хочу создать 1 счет и получить 2 дебетовые карты для меня и моей жены чтоб информация об балансе и тд приходило на моб на оба мобильных телефона т е мне и name так же чтоб она отображалась в bankname онлайн
659,благодарность,хочу сказать спасибо bankname за своего сотрудника name name которая работает в п бугры грамотный вежливый всегда доброжелательна расскажет все подробно по всем вопросам стало приятно заходить в ваше отделение bankname спасибо
660,жалоба на продукты услуги bankname,акц комфортел num регион name область населенный пункт ульяновск вопрос клиента не работает bankname по адресу улица сороколетия октября 9 номер устройства num
661,вопрос,пришло смс сообщение от bankname с исходящим номером num ранее получал по мобильному bankname от номера num сообщение об оценке качества услуг сб реально ли это ваш адресат или что то другое
662,не работает bankname,в г балашиха мкр павлино д 35 с 1 больше месяца сломан bankname ближайшее отделение bankname по адресу мкр павлино д 15 закрылось в num году прошу исправить ситуацию
663,неработоспособность ус,акц ик num месторасположения ус г name пр т name пр т name номер ус num дату и время попытки проведения операции date в time характер поломки ус не принимают наличные клиент настоял на регистрации
664,жалоба на продукты услуги bankname,акц комфортел num регион кировская область населенный пункт арбаш вопрос клиента получил письмо по материальной выгоде с номером num клиенту недостаточно информации более подробную информацию не предоставил
665,причина кто наложил арест,акц комфортел num всп bankname в котором ведется счет г омск ул профинтерна карта моментальной выдачи карты счета вклада num вопрос клиента причина кто наложил арест
666,возврат денежных средств,дата операции date время time номер документа num отправитель num получатель num сумма num name авторизации num фио name name л прошу вернуть мне мои средства обратно
667,жалоба на продукты услуги bankname,акц комфортел num регион город москва населенный пункт город москва вопрос клиента я не являюсь клиентом bankname уже давно но звонят и навязывают услуги пожалуйста разберитесь с этим
668,мобильный bankname,прикладываю дополнительные фото отображение баланса на главной странице показывается один а на текущем балансе показывается какой должен быть баланс карты
669,отключение рекламных рассылок,акц комфортел num территориальный bankname name bankname bankname карты кредитного договора уфа телефона отправителя смс уведомления num телефона на который поступило смс num вопрос клиента отказ от рекламных рассылок
670,обслуживание,акц ик num клиент сообщает что отделение bankname через которое происходит зачисление денежных средств name пенсионного фонда задерживает перевод средств физическим лицам пенсионных выплат
671,жалоба на недозвон в урпзфл,номер телефона на который обращался клиент num номер телефона с которого звонил клиент num вопрос клиента не смогла дозвониться на номер num образовалась просроченная задолжность по кредиту срок задолженности более 40 дней сейчас есть возможность оплачивать
672,жалоба на продукты услуги bankname,акц комфортел num регион тюменская область населенный пункт тюмень вопрос клиента жалоба на обслуживание длительное рассмотрение рассмотрение обращений
673,жалоба,скажите когда я получу ответ на поставленные вопросы в ваш bankname это уже третье письмо посланное вам на tr url вопрос всё тот же в num году вами выпускалась карта tr tr tr на какой срок действия она выпускалась
674,статус исполнительного документа,акц комфортел num всп bankname в котором ведется счет num карты счета вклада не определено дата подачи документов на снятие наложение ареста date вопрос клиента статус исполнительного документа
675,ипотека,здравствуйте номер договора num могут ли мне списать по гос программе 10 долга по ипотеке если был перевод в другую организацию и снизилась заработная плата
676,жалоба на продукты услуги bankname,акц комфортел num регион краснодарский край населенный пункт name район вопрос клиента приходят несколько раз в месяц смс о состоянии баланса карты все время в одной сумме
677,жалоба,здравствуйте сегодня date в отделении по адресу г калуга ул name 21а мне было отказано в услуге оплаты коммунальных платежей наличными время обращения зауслугой tr талон tr время на талоне time окно 7
