,category,text
1903,вопрос,здравствуйте скажите пожалуйста у меня есть кредитная карта льготный период закончился я ушла в кредит заплатила обязательный платеж вопрос могу я продолжать ей пользоваться или только когда полностью ее погашу заранее спасибо
1904,получение информации,добрый день мне необходимо выяснить дату открытия счета к зарплатной карте для указания в сведениях о доходах госслужащих последние 4 цифры номера карты num
1905,неработоспособность ус,акц ик num со слов клиента г москва ул большая name сняла деньги в bankname num хочу внести на другую карту bankname num num num не принимает только что выданные деньги что мне думать на эту name купюру она фальшивая
1906,жалоба на продукты услуги bankname,акц комфортел num регион республика бурятия населенный пункт г улан удэ вопрос клиента жалоба на списание комиссии на снятие наличных по кк в размере num руб
1907,вопрос,здравствуйте у меня вопрос по мобильному приложению bankname онлайн я не не могу скачать его для виндовсфона с магазина его там просто нет всегда был а сегодня date его нет может проводятся какие то обновления
1908,претензия,прошу сделать возврат денежных средств по кредитному договору num от date снятые за неустойку непредоставленных вовремя документов страховка была уплачена date
1909,вопрос,можно ли перевести деньги с кредитной карты на кредитную карту клиенту bankname и если можно то как в bankname это можно сделать инструкцию пожалуйста если можно
1910,жалоба связана с услугой bankname онлайн,нет более пожходящей тематики акц комфортел num регион name область населенный пункт name вопрос клиента не доступно формирование выписок за прошедший num для подготовки отчета по налогам гос служащего
1911,кредит,добрый день у меня есть действующий кредит в вашем bankname зарплатный клиент произведено четыре выплаты могу ли я взять у вас второй кредит не удалось изменить год рождения правильно num год
1912,вопрос,добрый день хочу отправить денежный перевод через систему вестерн юнион безналично однако платеж не проходит по причине превышен лимит можно уточнить какой лимит существует по подобным платежам
1913,жалоба на продукты услуги bankname,акц комфортел num регион пермский край населенный пункт пермь вопрос клиента звонок поступил в time клиент просит чтобы звонки поступали согласно закону
1914,ипотека,добрый день если я хочу взять в ипотеку квартиру за num и внесу первоначальный взнос num какие потребуются документы вообще хотелось бы узнать весь процесс ипотеки
1915,жалоба связана с услугой bankname онлайн,акц комфортел num регион name область населенный пункт астрахань вопрос клиента отсутвие возможности функции сохранения чека об оплате платежей в сбол ранее данная функция присутствовала
1916,жалоба на продукты услуги bankname,акц комфортел num регион ставропольский край населенный пункт ставрополь вопрос клиента клиент перевел мошенникам денежные средства карты num name name name
1917,ипотека,здравствуйте скажите пожалуйста могу ли я поменять квартиру на дом дело в name что квартира находится в ипотеке в вашем bankname брали num долг на сегодня num стоимость квартиры num хотим поменять на дом возможно ли это и что для этого нужно
1918,жалоба на продукты услуги bankname,акц комфортел num регион name край населенный пункт name вопрос клиента клиент просит отключить все рекламные рассылки и специальные предложения от bankname от его номера num
1919,жалоба на продукты услуги bankname,акц комфортел num регион name область населенный пункт name вопрос клиента комунальные платежи оплачивает терминал оплатите пожалуйста на терминале name сотрудник отказался это сделать name улица
1920,получение информации,добрый день прошу проинформировать о механизме получения деталировки движения средств на зарплатной карте за февраль март num все платежи съемы зачисления
1921,многозвонящий клиент,акц комфортел num многозвонящий клиент екатеринбург данный клиент оставлял ранее обращение так как отделение bankname в городе клиента в выходные дни не работает не согласен с ответом
1922,возврат денежных средств,date в time 28 оплачивала штраф в через bankname num номер операции num bankname принял купюру num рублей и выдала чек о техническом сбое прошу вернуть денежные средства в размере num рублей на карту num
1923,вопрос,можно ли на карте со своим дизайном сделать функцию бесконтактная оплата и еще один вопрос если заказать карту num рублей нужно платить при получении карты или на карте будет tr
1924,вопрос,здравствуйте 24 февраля т г я написала заявление на досрочное погашение кредита сумма досрочного гашения num руб снимут их сегодня могу ли я сегодня переписать заявление и снизить сумму досрочного гашения до num руб
1925,жалоба на продукты услуги bankname,акц комфортел num регион мурманская область населенный пункт мурманск вопрос клиента требуют рабочий телефон или домашний при выдаче кредитной карты которую он заказывал на сайте сбол но данных номеров у клиента нет
1926,жалоба на недозвон в урпзфл,акц комфортел num номер телефона на который обращался клиент num номер телефона с которого звонил клиент num вопрос клиента звонил 4 раза по реструктуризации кредита не берут трубку
1927,жалоба на недозвон в урпзфл,акц комфортел num номер телефона на который обращался клиент num номер телефона с которого звонил клиент num вопрос клиента пакет документ который необходимо предоставить по гос программе реструктуризации ипотеки
1928,жалоба на продукты услуги bankname,акц комфортел num регион name область населенный пункт name вопрос клиента совершен звонок от bankname около time предлагали оформить кредитную карту требовали устного согласия не менее 5 раз
1929,bankname,клиент уже обращался по поводу данного bankname он снова не работает акц аудиотеле num со слов клиента периодически не работает bankname num по адресу город барнаул улица name name дом 6крытый рынок
1930,возврат денежных средств,date г мною через bankname онлайн с карты num ошибочно был совершен платеж оплата мобильной связи на номер num возможно ли вернуть денежные средства на карту
1931,претензии на доп офис,акц комфортел num дата и время произошедшей ситуации обращения в всп date подробное описание произошедшей ситуации не в первый раз задерживаются платежи или вовсе не приходят
1932,благодарность,хочу поблагодарить заместителя num name ю н за хорошее обслуживание в течении многих лет его работы на его должности а в его лице и его сотрудников побольше бы таких людей в bankname
1933,возврат денежных средств,я name name name оформляла возврат средств на карту date name авторизации num сумма num 99 номер терминала num денежные средства не были зачислены на карту прошу разобраться и вернуть деньги на карту номер num
1934,отключение рекламных рассылок,акц комфортел num номер на который поступают звонки num номер с которого поступают звонки num вопрос клиента хочу отказаться от информирования и дальнейшего получения предложений оформить продукты и услуги bankname
1935,возврат денежных средств,с карты num была совершена покупка через интернет на сумму num рублей 01 февраля был возврат с организации на эту же сумму денежные средства не поступили номер платежа num прошу разобраться в name ситуации
1936,вопрос,добрый день я получил кредитную карту в вашем bankname с лимитом num руб могу ли я совершить покупку в магазине в размере num руб с использованием name карты
1937,вопрос,здравствуйте подскажите пожалуйста сколько раз в день можно переводить с карты с номера num на карты привязанные к мобильным номерам пример перевод num
1938,вопрос,добрый день интересует такой вопрос у меня покупатель name мурома name область у нее ипотека от bankname name на то чтобы я подписала с ней куплю продажу а потом на следующий день она поедит подписывать кредитный договор разве так можно
1939,мобильный bankname,здравствуйте как мне разблокировать услугу мобильный bankname если не я не имею доступа к ближайшему отделению bankname num номер карты num номер телефона контрольное слово кросс
1940,отключение рекламных рассылок,акц комфортел num номер на который поступают звонки num номер с которого поступают звонки num вопрос клиента прошу не звоноть по рекламным акциям и прочим услугам и продукции bankname
1941,жалоба связана с услугой мобильный bankname,акц комфортел num регион город санкт петербург населенный пункт санкт петербург вопрос клиента не высылать сообщения в такое раннее время time удобно будет получать сообщения не ранее time и не позднее time
1942,смс рассылка,акц аудиотеле num со слов клиента после подключения номера к bankname на номер клиента приходят смс сообщения на чужого человека о наложении ареста клиент просит чтобы эти смс сообщения больше не приходили
1943,получение информации,ревизионная комиссия тсж 17 расположенного по адресу num пермь газонная 5 просит предоставить информацию предоставление которой предусмотрено действующим законодательством текст запроса во вложении телефон для связи num name name name
1944,обслуживание,город казань ул вешневского 57 клиент клал денежные средства в доллорах не уточнили счет куда она хотела положить денежные средства клиент хотела положить денежные средства на валютный счет их положили на рублевую карту
1945,кредитная карта,при погашении долга по кредитной карте num могу ли я её использовать заново пользоваться кредитом в офисе bankname конкретного и ясного ответа не получил спасибо
1946,жалоба,добрый вечер в городе махачкала ужасная ситуация с bankname столько люди жалуются примите уже какие ни будь меры хватит отвечать по шаблону конкретно отправьте человека для решения вопроса
1947,жалоба,в результате ошибки допущеной сотрудником bankname г набережные челны не были перечислены кредитные средства на счет продавца продавец несет убытки кредитный договор num tr
1948,жалоба,в ипотечном центре на проспекте name на сопровождении работает один специалист очередь огромная даже по небольшим вопросам приходится сидеть по несколько name
1949,смс рассылка,акц аудиотеле акц num date получил смс с предодобренным кредитом на сумму num на номер num получаю пенсию на карту bankname обратился в отделение пришел отказ прошу не присылать мне больше смс такого характера
1950,жалоба на недозвон в урпзфл,акц комфортел num номер телефона на который обращался клиент num номер телефона с которого звонил клиент num вопрос клиента статус рассмотрения по помощи ипотечным заемщикам
1951,ипотека,здравствуйте я оформлял ипотеку date процентная ставка была 11 9 сейчас вы одобряете ипотеку под меньший процент могу ли я рассчитывать на снижение моей процентной ставки
1952,ипотека,здравствуйте кредитный договор num от date подскажите может ли различаться полная стоимость кредита указанная в кредитном договоре и графике платежей в прикрепленном файле в двух графиках разная полная стоимость кредита это нормально спасибо
1953,консультация,прошу проконсультировать мне требуется оплатить взнос за квартиру в гк андор партнер bankname какой процент с меня будет удержан при переводе денежных средств на счет гк андор
1954,жалоба,ранее обращалась но на мое обращение нет ответа и его продлили еще на 2 месяца name за персонала ранее были проведены некорректные операции прошу принять меры и кратчайшие сроки дать ответ иначе я буду вынуждена обращаться вышестоящий истанции
1955,жалоба на недозвон в урпзфл,акц комфортел num номер телефона на который обращался клиент num номер телефона с которого звонил клиент num вопрос клиента клиент не может дозвониться по данному номеру телефона в течении недели
1956,жалоба на продукты услуги bankname,акц комфортел num регион name область населенный пункт г томбов вопрос клиента списали за годовое обслуживание почему не поступило смс оповещение верните мои деньги
1957,жалоба на продукты услуги bankname,акц комфортел num регион республика дагестан населенный пункт г махачкала вопрос клиента клиент просит отменить последнюю операцию по его карте операцию о переводе num рублей
1958,причина кто наложил арест,акц комфортел num всп bankname в котором ведется счет республика калмыкия поселок яшалтинский район карты счета вклада num вопрос клиента причина кто наложил арест
1959,получение информации,здравствуйте я гражданин армении name name являюсь собственником двухкомнатной квартиры в москве стоимостью примерно 6 млн руб постоянной работы в рф не имею могу ил я получить кредит в вашем bankname под залог своей квартиры в размере 2 млн рублей
1960,жалоба,добрый день мою карточку заблокировали а об этом узнаю последняя смс на мой телефон не было пришла смс с моей конфидециальной информацией на старый номер по привязке моему мужу он мне об этом и сообщил как это
1961,перевыпуск карты,мной была получена кредитная карта в г сковородино name области на данный момент я нахожусь в г красноярске name края срок действия карты заканчивается date могу ли я обратиться за перевыпуском по месту нахождения м
1962,причина кто наложил арест,акц комфортел num всп bankname в котором ведется счет г санкт петербург ул авиаконструкторов карты счета вклада num вопрос клиента причина кто наложил арест
1963,bankname,город санкт петербург проспект name д65 корпус 1 вермя num банокмат зажевал денежные средства 95 тысяч bankname не выдал чек и на карту деньги не зачислились
1964,консультация,доброе время суток подскажите пожалуйста я гражданин республики казахстан хочу открыть рублевую дебетовую карту в bankname россии какие документы мне необходимы для получения и какие сроки
1965,возврат денежных средств,date я через bankname онлайн хотел положить себе денег на телефон но ошибся в цифре отправил на num а нужно на num переводил num рублей с карты num прошу либо вернуть деньги на карту либо на нужный номер спасибо
1966,ипотека,здравствуйте могу ли я взять ипотечный кредит с использованием материнского капитала в ивановской области если постоянная прописка в мурманской являюсь заплатным клиентом bankname
1967,получение информации,здравствуйте по поводу обращения num от date хотелось бы уточнить каким способом мне дадут ответ по почте или по е tr хотелось бы получить до 26 02 по tr tr
1968,жалоба на продукты услуги bankname,акц комфортел num регион город москва населенный пункт москва вопрос клиента со слов клиента date оставлял обращение по эл почте для снятия обремения с объекта недвижимости до сих пор с клиентом никто не связался
1969,смс рассылка,акц аудиотеле tr на мой номер телефона num поступило смс сообщение о выпуске карты виза num данную карту я не выпускала прошу проверить данную информацию и исключить мой номер телефона name смс рассылок
1970,жалоба,date г по адресу г мончегорск пр т металлургов 32 в 12 25 ваша машина инкассаторов припарковалась колесом на ограждении тем самым его повредив просьба восстановить повреждённый участок ограждения фото события прилагаются
